{
  "id": "righteous_leap_ab",
  "name": "Righteous Leap",
  "description": "Rush to an enemy 8 to 25 m away; your next attacks hit 10% harder for 5 s.",
  "owner": "templar_zealot",
  "kit_slot": "mobility",
  "school": "physical",
  "cast_type": "instant",
  "cooldown_s": 25,
  "triggers_gcd": false,
  "range_m": 25,
  "requires_los": true,
  "target": "enemy",
  "effects": [
    {
      "type": "charge"
    },
    {
      "type": "apply_aura",
      "aura": "righteous_momentum",
      "affects": "self"
    }
  ],
  "icon": {
    "symbol": "righteous_leap",
    "school": "holy",
    "image": "lorc/fire-dash"
  },
  "min_range_m": 8
}
