{
  "id": "sepulchral_howl_ab",
  "name": "Sepulchral Howl",
  "description": "Enemies within 8 m are disoriented for 4 s. Heavy damage breaks it.",
  "owner": "deathsworn",
  "kit_slot": "cc",
  "school": "shadow",
  "cast_type": "instant",
  "cooldown_s": 60,
  "triggers_gcd": true,
  "range_m": 0,
  "requires_los": false,
  "target": "self",
  "effects": [
    {
      "type": "apply_aura",
      "aura": "howl_dread",
      "affects": "enemies_in_radius",
      "radius_m": 8
    }
  ],
  "icon": {
    "symbol": "sepulchral_howl",
    "school": "shadow",
    "image": "lorc/wolf-howl"
  },
  "cost": {
    "resource": "runes",
    "amount": 1
  }
}
